{"CompanyId":"qoV9Vfw7",
"ImporterEmail":"hr@oracle.xxx",
"ReportEmail":"hr@oracle.xxx",
"DoNotSyncOnWarnings":false,
"OverwriteEmployeeNamesAndEmail":false,
"Employees":[
{
"FirstName":"Mary995",
"LastName":"Doe",
"Name":"Mary995.Doe@JDInc.us",
"DepartmentName":"",
"LocationName":"Burlingame",
"RegionName":"",
"SubsidiaryName":"",
"Role":"Administrator",
"Title":"Architect",
"EmployeeId":"",
"Address":"Mehboob Nagar",
"Address2":"",
"City":"Latur",
"State":"MH",
"PostalCode":"413512",
"Country":"India",
"HomePhone":"023995252111",
"WorkPhone":"0999581995492",
"Mobile":"",
"CustomFields":[
{"Key":"VP",
"Value":"joe@JDInc.us"},
{"Key":"Reports To",
"Value":"Mose995.Doe@JDInc.us"}
]
},
{
"FirstName":"Mose995",
"LastName":"Doe",
"Name":"Mose995.Doe@JDInc.us",
"LocationName":"Burlingame"
},
{
"FirstName":"Mane995"
,"LastName":"Doe"
,"Name":"Mane995.Doe@JDInc.us"
,"LocationName":"Burlingame"
}
]
}